Username,Title,Date,Comment,rating
D-M0NEY,So far its working perfect...,2024-07-28,"I'm sure there's a few watches out there with issues, hence the multiple one-star reviews. No brand is perfect. But mine works great. I bought it when it went on sale after the 7 came out. I couldn't justify the price for the 7 when the 6 is nearly identical. The battery isn't super impressive but it'll last almost 2 days with normal use. But the glass screen is very strong. It's waterproof. Tons of modern features (my last smart watch was an LG from 2014, so this thing is hi-tech AF to me). I'll update to 5 stars if it lasts a few months without issues. I haven't tested the sleep mode yet, I keep forgetting. I always take my watch off before bed. But a watch isn't gonna fix your sleep habits, just tell you that you sleep like shhhhh...",4
Amazon Customer,i received an empty box,2024-10-08,i received an empty box but luckily when i contacted Amazon they replaced it immediately. my mom loves the watch,4
Angie,Bueno,2024-10-12,"Sólo decepcionada con el tiempo de duración de la bateria...hay que cargarlo diario, a diferencia de mis otros relojes.",4
Robert Stankes,Samsung Galaxy 6 Watch,2024-10-21,Easy to set up on Samsung phone. Functions very well. Easy to use. Previous watch was a Samsung Galaxy Active Watch.,5
Amazon Customer,Love my watch!,2024-10-21,"I love it! Everyone complains about the battery life, I find it manageable.",5
Darice Aldrich,Awesome,2024-10-18,"Bought for my son to go with his phone, he loves it!!!",5
Ken220,Just what I needed to make my granddaughter happy.,2024-09-03,I asked my teenaged granddaughter what she wanted for her birthday. She said that she needed a new watch. I told her to check out the different types of watches and let me know what she wanted. This Samsung Galaxy Watch 6 40mm Bluetooth Smartwatch is what she decided on. She has had it over four months and still says that she loves it. She likes the way it connects to her phone and puts so much of the information on her watch. She's happy with it.,5
Teri Tiffany,Love it,2024-10-21,Great watch! Battery only last 3 days wished it was at least 5 days but I still love the watch,5
Melvin,This box has been through alot,2024-09-21,So the box look like it been in a war and the watch look fine and two extar wristband are missing idk but hey the got a 1st party charge for the watch turn on look great,4
Francis,Love It,2024-10-18,"Classic, fits well and it same and operation says it all.",5
Lauren jenkins,watch,2024-10-18,"I love this watch, the look, the easiest to figure out",5
K Carter,So much better than Fitbit,2024-09-26,"After Google bought out Fitbit, my device needed to be replaced but this was SUCH a better option. It has far more features and can easily hook to my phone so I don't have to have separate service like other models. Keeps track of health things like sleep and stress, and also has the ability to fast answer texts or get reminders.",5
pwiebs,Stylish and better than apple watch.,2024-10-26,Stylish and better than apple watch. Wife loves it,5
Daniel,Samsung Galaxy Watch,2024-10-18,"Galaxy watch is awesome, comfortable, and easy to use",5
Kendra,Short Battery,2024-07-24,"I love the watch. I went from a fitbit to this. The only issue is the battery just lasts a day. I charged it at 5 last night and it is at 26% the next day at 11 am. I don't want to be charging it all the time. I track my sleep with it at night to charge is not an option. So during the day randomly I have to charge it. It also takes way longer than my versa to charge. I see that as really the only down fall of this. Honestly, it would have to be 100% charge in the morning to even last the whole day. And I'd you charge while you get ready in the morning it takes more than an hour to charge. Bummer.",4
Patricia Montes,Watch,2024-10-23,"I love it, never leave the house without it!",5
Bornfree,Great watch,2024-10-17,So many excellent features.,5
Joshua Parada,Great watch,2024-10-25,Great watch at a great price,5
Marlyn,Love it,2024-10-24,Is my 2nd watch I'm happy,5
LOTTET13,Perfect,2024-10-26,Excellent watch. Meets all my needs.,5
Dawn Marie Nathan,Perfect watch for me,2024-10-17,Great. Exactly what I want,5
oswin,No issues with this product.,2024-10-20,No issues with this product.,5
Edward Thomas,Perfect,2024-10-21,Exactly what we wanted,5
Dan,Another winning Samsung product,2023-09-29,"First off, the label next to my name says I’m a VINE VOICE reviewer. That is correct, however, please note that I paid for this watch myself with my own funds and the following are my unbiased and independent comments.",5
Debbi,great watch,2024-10-22,works great,5
Angela Scott,Good watch,2024-09-19,Only complaint is that you cannot take your blood pressure with this watch. They imply you can (which you can). They imply you can but ypu cannot in the USA as it does not have FDA approval. You can do heart rate and ekg. Most other things work great.,5
Lou,"Battery length, and the variety of watch faces",2024-09-03,This watch is so much more accurate than my 4 and I love all of the face customizable choices I get. The charge lasts over three days instead of one and the fit is great. I bought it for an amazing price and it tracks my sleep much better than my old one. It even tracks temperature. I love the look with thee band I chose I hope it lasts for a very long time.,5
S.J.,Nice watch,2024-08-28,"I got this to monitor my sleep patterns, but it didn't seem to work. Turns out it's because I wasn't really sleeping. Now that I have a cpap machine it tracks my sleep just fine",4
Gennaro,OVERALL WATCH,2024-09-22,"Great watch. Functions are useful, looks very nice, but can you please do something about the battery . Costly watch for this battery challenge",4
Jian Shimada,I like it,2024-10-08,Feel good to wear this than has worn apple watch is very uncomfortable,5
Green Blue,Best smart watch I've owned,2024-09-03,"My Samsung Active 2 died after about four years, and I liked it so much that I decided to get another Samsung smart watch. This one is so much better, lots of new features but still familiar. I use it most for messages, health monitoring, and controlling my music on Spotify. I saw the some people complained about battery life, but mine is great. I charge it every other day, which I think is reasonable.",5
Alina Castaneda,Big Watch,2024-09-14,"I like the watch it fits my needs. I use for it steps, but also it keeps the heart rate, bmi, etc. It's a big, I'm a small woman and I like big the larger watches. The battery life is the only negative if I were to say anything. Not a big deal I just charge it. About 2 days prior to recharging.",5
Tranicj,Watch ⌚️,2024-10-07,"I ordered black but got grayish looking color,otherwise from that it's perfect",5
Olivander,Stylish and Useful Co-pilot for Everyday Activities!,2024-07-24,Why I’m Loving It:,5
Christina A,Galaxy watch,2024-08-20,"This is my first smart watch. I've been putting off getting a smart watch because I didn't like how big the face was. When I was looking online I didn't realize that it was geared more towards being used for health reasons. Which is actually fine with me. I love that it connects to my phone very quickly. The screen isn't huge and it's easy for me to read. I bought this on Amazon Prime Day so I got a great deal for it. I did go and buy different watch bands. I didn't want a plain one. I wish the battery lasted longer. I'm not a huge fan of charging it once a day. Other than that, I really like this smart watch and glad I finally bought one.",5
yankeemama,Battery life sucks!,2024-07-03,"I chose a Samsung watch because I have other Samsung products, TV, phone and tablet, and all are great. I had hoped this would be too. The watch is nice, easy to set up and use, but the battery has to be charged every day. I have been charging it off my tablet because I was not aware the charger plate did not come with it. That is something that should be stressed in the description. At least I have a means of charging until I can get one. I don't use most of the apps and still the battery is low by bedtime, so has to be charged again. The watch is good for a senior like me, easy to read and who won't be doing a ton of stuff on their watch like a younger person. I can't imagine the battery if used a lot during the day for apps. A good watch? It serves it's purpose for my needs, so yes. A great watch? Absolutely not until they can do something about the battery life.",4
Lindsey Brow,Love it!,2024-09-15,The 40mm is perfect for a small size wrist. Use it to track my activity throughout the day and running pace for the 5ks. Seems to be pretty durable and no issues when it has gotten rained on.,5
Amazon Customer,Watch 6,2024-10-11,Gave this to my wife for her birthday. Great smartwatch.,5
Kimberly Marsh,I love this watch!,2024-10-01,This watch is just the right size with lots of functions.,5
