Username,Title,Date,Comment,rating
Users,Sloppy packing inside the case - DAMAGED MB connection. Returning.,2024-02-09,Skytech crammed so much packaging material INSIDE the case that they smashed the D_LED1 RGB connection hard enough that they broke off one of the pins inside the connection and badly bent the other 3 pins. Check out some of the YouTube videos of the Nebula unpacking and you'll see how they pack it. There was too much material and somebody just smashed it in there so that they could get the cover on. But then they put it inside a shipping box the was too big and didn't pack anything around it - so it was loose inside the box.,3
Ceiondre,Good,2024-08-04,"Pretty good for a beginner gaming pc, runs all",5
Internet Hillbilly,So far so good,2024-07-22,I was a little concerned when I downloaded Oculus link to play VR games. It was saying this computer does not support VR gaming though this link. So far it is still doing quite well with VR chat.,5
Mik,"Great quality, amazing",2024-08-10,"Easy set up, great quality would buy again.",5
Eli Coco,Amazing Starter PC,2024-07-22,I was very skeptical about getting my first PC on amazon let alone a pre built but i caved in and got it and it doesn't disappoint! I highly recommend this PC if you aren't looking to build one.,5
Christine,Works Great,2024-07-30,I bought this for my 16-year-old who is a huge gamer. And it works Great and does everything he expected it to do.,5
Fabián Rodríguez,Skytech,2024-08-11,"excelente computador, veloz, fácil de actualizar",5
Ken Griffin,getting an amazing computer,2024-06-15,easy to assemble might need to look up the pictures too hook up the back but thats easy to find but it will play all your games at a high quality I have had no issues with it and it comes with two items not listed in the product description three if you count the bag it was in overall best computer i have had before and good price too. oh the two products are a keyboard and mouse.,5
B. King,great,2024-06-08,impressed,4
Raymond bandeau,Bought for my wife and she loves it,2024-06-24,"Bough as a present for my wife and she loves everything about this computer, gotta say though the only thing we didn’t completely agree with is the boxing it came in was not discreet at all so as it’s sitting on my porch for all to see they could easily tell what was in the box, other than that would recommend this brand and computer!",5
cory coleman,INCREDIBLE,2024-05-22,"I was very skeptical buying a pre built pc on Amazon of all places! However, this PC is absolutely amazing!! Runs very nice and fast. I recommend this PC to anyone who looking for a pre built",5
Sebastian,Great pc,2024-06-25,"I never had a pc before, but this one can run any game perfectly, any sort of gaming you do this pc can run it, the fan noise is very low and even makes less noise than my ac, nice case as well, everything about this computer is amazing would definitely buy again",5
Ryan Glickfeld,wifi problems,2024-01-06,"This pc is amazing for the price but I will say this, you definitely will need to buy a separate wifi adapter. This pc comes with a super crappy wifi adapter that gets a max of 10 ish mbps of download speed and usually stays in the 3-5 mbps range. My old pc used to easily get 50+ mbps, so I know it’s not my wifi thats the problem. I tried to fix this frustrating problem, but nothing seems to work. Be prepared to spend 15-20 bucks on a wifi adapter, if you wanna play online games on wifi.",4
Jonathan Moreno #2,"Wow, this is really great actually!",2024-06-27,Play Video,5
Michael,Great pc for the price,2024-06-07,Amazing pc for the price. Absolutely amazing but did already order a 4070 super to replace the 4060. 4060 will be enough for most doing normal gaming but i sim race in titles like acc that take a bit of power to do nicely. The 4070 super in thus build will do me perfectly! But for 850 getting this build in general even with the 4060 runs amazing.,5
Michael,Great but…,2024-02-02,"Update: 2 month update, still amazingly fast, runs vr great on medium high settings",4
Grabindragon,Pretty good for the price,2024-03-07,Good specs. Good price. Looks nice. One problem i got a corrupted ram stick and i couldnt get a new one unless i refunded the whole pc but there are worse things then a ram stick being bad. Overal tiny bit dissapointed but would recomend if u want something decent at a decent price,4
Centrifikal,Good for 1080p gaming,2023-12-14,I bought this rig for my son. I was going to build my own and then came across this on sale. It is not a bad deal for the components. The motherboard and GPU brand I got was Gigabyte. The Memory and SSD were T Force. Those would not be my first choices for hardware but I know you can't choose what brand you want with these pre-built computers. I had to go into the bios and fine-tune the case fans and change sensor location as they were pretty loud out of the box. The expanding foam is secure for shipment but you have to cut the stuff out of the tower or you can risk bending parts trying to remove it otherwise. Other than that I am pretty pleased with this purchase. It is a good rig for 1080 p gaming. Plays most games on ultra 1080p near 60 fps.,5
J.F. Sawyer,Incredible for the price point!,2024-06-16,"This computer is an excellent entry level pc for those interested in both gaming and 3d animation. I just bought this as a replacement for my desktop which I had for many years, and so far it’s been stellar, which is pretty impressive at this price. Thanks skytech!",5
Kenny wyatt,For me it's a great pc,2024-07-02,I'm not a pc geek but it's runs really well gave me no difficulty running it good if you're on a under $1000 budget it's a great pc,5
Jenica,PERFECT BUDGET PC EVER,2024-07-26,this is the BEST budget prebuilt gaming pc you could ever get,5
Jose Lopez,The cooling fan LED light,2024-02-09,Overall the pc preforms well and their are nothing that wrong with it but i just can’t find out how to change the cooling fans led light and when i press the led light button nothing changes. the pc runs good fps on any game and if anyone can help me with the led light option please do.,4
Alicia Miller,It works great for gaming comes with a keyboard and cool mouse,2024-06-21,Play Video,5
Ryan Jensen,Fast customer support and easy to setup,2024-06-07,"Had a trouble with one of my fans upon arrival, talked with support and they sent me a new one. Worked well and haven’t had any troubles. Good for the money",5
Best speaker so far,This pc is a really good budget pc,2024-06-01,Play Video,5
Todd Ashford,Amazing build at an affordable price,2024-07-01,Super impressed with this pre-built pc. It has run Diablo 4 and League of Legends on the highest quality perfectly. Amazing value for the price,5
Larry J.,Good gaming computer.,2024-07-12,Very impressive gaming computer.,5
michael,great overall,2024-07-03,"runs great still after about a month. very fast, not too loud, looks good. would recommend so far!",5
Mabbott,Great Pc,2024-06-27,I’m a big skytech gaming fan. I have owned several pc’s by them and all have been wonderful with high quality parts and well made design.,5
It’s not working,BEAST of a pc,2024-07-01,This pc is an absolute beast it can run beamng drive like it’s nothing and has 930G of storage!,5
